{
  "$schema": "https://json-schema.org/draft/2020-12/schema",
  "$id": "https://lstepnio.github.io/ESP32OBD2/contracts/release-manifest.schema.json",
  "type": "object",
  "properties": {
    "schemaVersion": {
      "const": 1
    },
    "version": {
      "type": "string",
      "minLength": 1,
      "maxLength": 40,
      "pattern": "^[0-9]+\\.[0-9]+\\.[0-9]+(-[a-zA-Z0-9.]+)?$"
    },
    "releaseSequence": {
      "type": "integer",
      "minimum": 1,
      "maximum": 4294967295
    },
    "boardId": {
      "const": "waveshare-esp32-s3-touch-lcd-1.28"
    },
    "boardRevisions": {
      "type": "array",
      "items": {
        "type": "string",
        "minLength": 1,
        "maxLength": 32
      },
      "minItems": 1,
      "maxItems": 16
    },
    "chip": {
      "const": "esp32s3"
    },
    "partitionLayout": {
      "const": "egauge-16m-ab-v1"
    },
    "imageBytes": {
      "type": "integer",
      "minimum": 1,
      "maximum": 4194304
    },
    "imageSha256": {
      "type": "string",
      "minLength": 1,
      "maxLength": 64,
      "pattern": "^[a-f0-9]{64}$"
    },
    "releaseNotesSha256": {
      "type": "string",
      "minLength": 1,
      "maxLength": 64,
      "pattern": "^[a-f0-9]{64}$"
    },
    "protocolMajor": {
      "const": 1
    },
    "configSchemaMin": {
      "type": "integer",
      "minimum": 1,
      "maximum": 65535
    },
    "configSchemaMax": {
      "type": "integer",
      "minimum": 1,
      "maximum": 65535
    },
    "minimumBootloader": {
      "type": "string",
      "minLength": 1,
      "maxLength": 32
    },
    "channel": {
      "enum": [
        "development",
        "beta",
        "stable"
      ]
    },
    "keyId": {
      "type": "string",
      "minLength": 1,
      "maxLength": 64
    },
    "metadataSignatureAlgorithm": {
      "const": "ecdsa-p256-sha256-jcs"
    },
    "imageSignature": {
      "const": "esp-idf-signed-app"
    }
  },
  "required": [
    "schemaVersion",
    "version",
    "releaseSequence",
    "boardId",
    "boardRevisions",
    "chip",
    "partitionLayout",
    "imageBytes",
    "imageSha256",
    "releaseNotesSha256",
    "protocolMajor",
    "configSchemaMin",
    "configSchemaMax",
    "minimumBootloader",
    "channel",
    "keyId",
    "metadataSignatureAlgorithm",
    "imageSignature"
  ],
  "additionalProperties": false
}
